{
  "case_id": "20_azure_nd_mi300x_v5",
  "name": "Azure ND MI300X v5",
  "vendor": "Microsoft Azure",
  "year": 2026,
  "architecture": "8×MI300X + dedicated 400G/GPU",
  "sources": [
    {
      "title": "ND MI300X v5 sizes series",
      "url": "https://learn.microsoft.com/en-us/azure/virtual-machines/sizes/gpu-accelerated/ndmi300xv5-series",
      "type": "Microsoft Learn"
    }
  ],
  "metrics": {
    "gpu_memory_gb": {
      "value": 1536,
      "unit": "GB",
      "verifiable": true
    },
    "network_nic_count": {
      "value": 8,
      "unit": "NICs",
      "verifiable": true
    }
  }
}
